{
  "$schema": "https://json-schema.org/draft/2020-12/schema",
  "title": "AI_OS Overnight Candidate Criteria",
  "type": "object",
  "additionalProperties": false,
  "required": ["stage_id", "full_overnight_candidate_allowed", "human_approval_required", "red_team_review_required", "live_trading_status", "broker_execution_status", "oanda_status", "pi_gpio_motor_status", "api_key_required", "api_key_printed", "fail_closed"],
  "properties": {
    "stage_id": { "type": "string" },
    "full_overnight_candidate_allowed": { "type": "boolean" },
    "human_approval_required": { "type": "boolean" },
    "red_team_review_required": { "type": "boolean" },
    "live_trading_status": { "type": "string" },
    "broker_execution_status": { "type": "string" },
    "oanda_status": { "type": "string" },
    "pi_gpio_motor_status": { "type": "string" },
    "api_key_required": { "type": "boolean" },
    "api_key_printed": { "type": "boolean" },
    "fail_closed": { "type": "boolean" }
  }
}

